{
  "$schema": "https://json-schema.org/draft/2020-12/schema",
  "$id": "https://gestion-cuverie-cidricole.local/schemas/site.schema.json",
  "title": "Site",
  "type": "object",
  "required": ["id", "name", "code", "active", "createdAt", "updatedAt"],
  "additionalProperties": false,
  "properties": {
    "id": { "type": "string", "format": "uuid" },
    "name": { "type": "string", "minLength": 2 },
    "code": { "type": "string", "minLength": 2, "maxLength": 24 },
    "address": { "type": "string" },
    "active": { "type": "boolean" },
    "createdAt": { "type": "string", "format": "date-time" },
    "updatedAt": { "type": "string", "format": "date-time" }
  }
}

