[
  {
    "id": "11111111-1111-4111-8111-111111111111",
    "name": "Atelier Val de Rance",
    "code": "VDR",
    "address": "Bretagne",
    "active": true,
    "createdAt": "2026-05-18T09:00:00.000Z",
    "updatedAt": "2026-05-18T09:00:00.000Z"
  },
  {
    "id": "22222222-2222-4222-8222-222222222222",
    "name": "Chai du Bocage",
    "code": "BOC",
    "address": "Normandie",
    "active": true,
    "createdAt": "2026-05-18T09:00:00.000Z",
    "updatedAt": "2026-05-18T09:00:00.000Z"
  }
]
